"Timestamp","クラウドワークスのユーザー名を入力してください
承認作業に必要となります。ユーザー名が未入力もしくはクラウドワークス側での作業者情報と一致しない場合、恐れ入りますが報酬をお支払いできませんのでご注意ください。また、ユーザー名はヘッダーメニュー、またはプロフィールページからご確認いただけます。表示名とは異なりますのでご注意ください。","年齢(半角英数字)","性別","会話文1における「そうなんですよ。ぜひ読んでみてください。」とはどういうことかを2文程度で説明してください．","会話文1における「そうなんですよ。ぜひ読んでみてください。」という発言の意図がわかる．","会話文1における「そうなんですよ。ぜひ読んでみてください。」という発言は唐突だ．","会話文2における「そうなんですよ。ぜひ読んでみてください。」とはどういうことかを2文程度で説明してください．","会話文2における「そうなんですよ。ぜひ読んでみてください。」という発言の意図がわかる．","会話文2における「そうなんですよ。ぜひ読んでみてください。」という発言は唐突だ．","会話文1における「そうなんですよ。ぜひ読んでみてください。」と会話文2における「そうなんですよ。ぜひ読んでみてください。」の意味は同じですか，異なっていますか．あなたの考えに最も近いものを選んでください．","会話文3における「ありがとうございます。」とはどういうことかを2文程度で説明してください．","会話文3における「ありがとうございます。」という発言の意図がわかる．","会話文3における「ありがとうございます。」という発言は唐突だ．","会話文4における「ありがとうございます。」とはどういうことかを2文程度で説明してください．","会話文4における「ありがとうございます。」という発言の意図がわかる．","会話文4における「ありがとうございます。」という発言は唐突だ．","会話文3における「ありがとうございます。」と会話文4における「ありがとうございます。」の意味は同じですか，異なっていますか．あなたの考えに最も近いものを選んでください．","会話文5における「確かに、あの行動力は素晴らしい。今の世の中にも坂本龍馬のような人が現れてほしいですね。」とはどういうことかを2文程度で説明してください．","会話文5における「確かに、あの行動力は素晴らしい。今の世の中にも坂本龍馬のような人が現れてほしいですね。」という発言の意図がわかる．","会話文5における「確かに、あの行動力は素晴らしい。今の世の中にも坂本龍馬のような人が現れてほしいですね。」という発言は唐突だ．","会話文6における「確かに、あの行動力は素晴らしい。今の世の中にも坂本龍馬のような人が現れてほしいですね。」とはどういうことかを2文程度で説明してください．","会話文6における「確かに、あの行動力は素晴らしい。今の世の中にも坂本龍馬のような人が現れてほしいですね。」という発言の意図がわかる．","会話文6における「確かに、あの行動力は素晴らしい。今の世の中にも坂本龍馬のような人が現れてほしいですね。」という発言は唐突だ．","会話文5における「確かに、あの行動力は素晴らしい。今の世の中にも坂本龍馬のような人が現れてほしいですね。」と会話文6における「確かに、あの行動力は素晴らしい。今の世の中にも坂本龍馬のような人が現れてほしいですね。」の意味は同じですか，異なっていますか．あなたの考えに最も近いものを選んでください．","会話文7における「そうですよね！大好きなうな丼を食べて気合いを入れて、転職に取り組んでみたいと思います！」とはどういうことかを2文程度で説明してください．","会話文7における「そうですよね！大好きなうな丼を食べて気合いを入れて、転職に取り組んでみたいと思います！」という発言の意図がわかる．","会話文7における「そうですよね！大好きなうな丼を食べて気合いを入れて、転職に取り組んでみたいと思います！」という発言は唐突だ．","会話文8における「そうですよね！大好きなうな丼を食べて気合いを入れて、転職に取り組んでみたいと思います！」とはどういうことかを2文程度で説明してください．","会話文8における「そうですよね！大好きなうな丼を食べて気合いを入れて、転職に取り組んでみたいと思います！」という発言の意図がわかる．","会話文8における「そうですよね！大好きなうな丼を食べて気合いを入れて、転職に取り組んでみたいと思います！」という発言は唐突だ．","会話文7における「そうですよね！大好きなうな丼を食べて気合いを入れて、転職に取り組んでみたいと思います！」と会話文8における「そうですよね！大好きなうな丼を食べて気合いを入れて、転職に取り組んでみたいと思います！」の意味は同じですか，異なっていますか．あなたの考えに最も近いものを選んでください．","会話文9における「ああ、ものは考えようですね！これからは、あなたのおっしゃるように、ポジティブに捉えたいと思います。」とはどういうことかを2文程度で説明してください．","会話文9における「ああ、ものは考えようですね！これからは、あなたのおっしゃるように、ポジティブに捉えたいと思います。」という発言の意図がわかる．","会話文9における「ああ、ものは考えようですね！これからは、あなたのおっしゃるように、ポジティブに捉えたいと思います。」という発言は唐突だ．","会話文10における「ああ、ものは考えようですね！これからは、あなたのおっしゃるように、ポジティブに捉えたいと思います。」とはどういうことかを2文程度で説明してください．","会話文10における「ああ、ものは考えようですね！これからは、あなたのおっしゃるように、ポジティブに捉えたいと思います。」という発言の意図がわかる．","会話文10における「ああ、ものは考えようですね！これからは、あなたのおっしゃるように、ポジティブに捉えたいと思います。」という発言は唐突だ．","会話文9における「ああ、ものは考えようですね！これからは、あなたのおっしゃるように、ポジティブに捉えたいと思います。」と会話文10における「ああ、ものは考えようですね！これからは、あなたのおっしゃるように、ポジティブに捉えたいと思います。」の意味は同じですか，異なっていますか．あなたの考えに最も近いものを選んでください．","会話文11における「なるほどー。わたしなんて、方向音痴な上に地図が読めないので、いまだに東京で迷子になりますよ！」とはどういうことかを2文程度で説明してください．","会話文11における「なるほどー。わたしなんて、方向音痴な上に地図が読めないので、いまだに東京で迷子になりますよ！」という発言の意図がわかる．","会話文11における「なるほどー。わたしなんて、方向音痴な上に地図が読めないので、いまだに東京で迷子になりますよ！」という発言は唐突だ．","会話文12における「なるほどー。わたしなんて、方向音痴な上に地図が読めないので、いまだに東京で迷子になりますよ！」とはどういうことかを2文程度で説明してください．","会話文12における「なるほどー。わたしなんて、方向音痴な上に地図が読めないので、いまだに東京で迷子になりますよ！」という発言の意図がわかる．","会話文12における「なるほどー。わたしなんて、方向音痴な上に地図が読めないので、いまだに東京で迷子になりますよ！」という発言は唐突だ．","会話文11における「なるほどー。わたしなんて、方向音痴な上に地図が読めないので、いまだに東京で迷子になりますよ！」と会話文12における「なるほどー。わたしなんて、方向音痴な上に地図が読めないので、いまだに東京で迷子になりますよ！」の意味は同じですか，異なっていますか．あなたの考えに最も近いものを選んでください．","会話文13における「うーん。反対に、嫌いなところはすぐに思いつくよ。この、骨と皮だけの身体をなんとかしたい！」とはどういうことかを2文程度で説明してください．","会話文13における「うーん。反対に、嫌いなところはすぐに思いつくよ。この、骨と皮だけの身体をなんとかしたい！」という発言の意図がわかる．","会話文13における「うーん。反対に、嫌いなところはすぐに思いつくよ。この、骨と皮だけの身体をなんとかしたい！」という発言は唐突だ．","会話文14における「うーん。反対に、嫌いなところはすぐに思いつくよ。この、骨と皮だけの身体をなんとかしたい！」とはどういうことかを2文程度で説明してください．","会話文14における「うーん。反対に、嫌いなところはすぐに思いつくよ。この、骨と皮だけの身体をなんとかしたい！」という発言の意図がわかる．","会話文14における「うーん。反対に、嫌いなところはすぐに思いつくよ。この、骨と皮だけの身体をなんとかしたい！」という発言は唐突だ．","会話文13における「うーん。反対に、嫌いなところはすぐに思いつくよ。この、骨と皮だけの身体をなんとかしたい！」と会話文14における「うーん。反対に、嫌いなところはすぐに思いつくよ。この、骨と皮だけの身体をなんとかしたい！」の意味は同じですか，異なっていますか．あなたの考えに最も近いものを選んでください．","会話文15における「ええ、そうだと思います。」とはどういうことかを2文程度で説明してください．","会話文15における「ええ、そうだと思います。」という発言の意図がわかる．","会話文15における「ええ、そうだと思います。」という発言は唐突だ．","会話文16における「ええ、そうだと思います。」とはどういうことかを2文程度で説明してください．","会話文16における「ええ、そうだと思います。」という発言の意図がわかる．","会話文16における「ええ、そうだと思います。」という発言は唐突だ．","会話文15における「ええ、そうだと思います。」と会話文16における「ええ、そうだと思います。」の意味は同じですか，異なっていますか．あなたの考えに最も近いものを選んでください．","今回の調査でかかった時間(分)を教えてください．(半角英数字)","よろしければ今回2文程度で説明をする際，どこに注目をして説明したかを教えてください．",""
"2023/12/25 5:44:31 AM GMT+9","jack the rip","44","男","そう言う事だから是非に読んで欲しいです","1","10","ファンタジーだから是非に読んで下さい","10","0","0","風邪の症状のように気軽に通えるカウンセラーになれる様、期待してくれてありがとう","10","0","水泳教室の様に多くの人が集まれる場所にしたくてそれを期待してくれてありがとう","9","0","10","あなたの憧れている坂本龍馬は素晴らしい。いまの世の中にも坂本龍馬のような人が現れてほしいです","9","0","確かに坂本龍馬の行動力は素晴らしい。
今の世の中にも坂本龍馬の様な人が現れてほしい","9","0","9","若い頃からどんどん挑戦する事はいいことだから大好きなうな丼を食べて気合いを入れて転職に取り組んでみたいと思います","9","2","若い頃からどんどん挑戦する事はいいことだから大好きなうな丼を食べて気合いを入れて転職に取り組んでみたいと思います","9","2","10","誕生日が4/1のエイプリルフールでいつもからかわれていたがあなたのおっしゃるように、逆に覚えてもらいやすいのでポジディブに捉えてたいと思ってる","10","0","誕生日が4/1のエイプリルフールでいつもからかわれていたがあなたのおっしゃるように、逆に覚えてもらいやすいのでポジディブに捉えてたいと思ってる","10","0","10","土地柄や色々な事柄に慣れてきたのですね。私は方向音痴な上に地図がよめなくで現在でも東京で迷子になってしまう","8","2","富士に嫁いできて数年ぐらいしか経ってなくてやっと土地柄にも慣れてきたのですね。わたしなんて方向音痴で地図もよめないので現在でも東京で迷子になってしまう。","10","0","5","好きな事は直ぐに思い出せないけど嫌な事は直ぐに思いつくよ。骨と皮だけの体をなんとかしたい","9","1","好きな事は直ぐに思い出せないけど嫌な事は直ぐに思いつくよ。骨と皮だけの体をなんとかしたい","9","0","10","家で出来る趣味があると気軽にストレス発散ができそうだと思う","10","0","インドアで出来る趣味があると気軽にストレス発散できると思う","10","0","10","20","最後の文の直前の文","ありがとうございました"
"2023/12/25 6:06:00 AM GMT+9","K.buena","43","女","おばあちゃんの起こし方は、大抵ソフトすぎて起きられない。なにかを読むことを勧めたい。","1","10","自分が好きな宮沢賢治の本はファンタジーだ。よんでみてほしい。","10","10","0","気軽に通えるカウンセラーを目指す自分を認めてくれて感謝している。同意してくれて安心しました。","10","0","カウンセリングを水泳教室の様に多くに人にとって身近なものにしたいという思いをわかってくれて感謝する。受け入れてくれて安心しました。","10","0","9","坂本龍馬は行動力があり、尊敬に値すると自分も思う。現代にも、彼の様な人材が必要だ。","10","0","坂本龍馬の行動力は素晴らしかった。現代でもあのような人が必要だ。","10","0","10","冒険したり挑戦したりするのはやっぱり良いことだと思う。大好きなうな丼を食べて、転職ちいう冒険に進むことにする。","10","2","やっぱり自分も冒険した方がいい。大好きなうな丼を食べて、転職を前向きに考えようと思う。","10","1","10","見方次第で良い様にも考えられるのですね。自分はエイプリル・フール生まれを嫌だと思っていましたが、あなたが言うように良い面に注目していこうと思います。","10","0","見方次第では嫌なものも好きになれますね。人にからかわれるのがで嫌でしたが、これからはあなたがいう様に良い面に注目していきたいです。","10","0","10","数年間生活しても、土地に慣れるには時間がかかりますよね。自分はずっと東京から離れたことがないのに、迷子になることさえあります。","9","4","数年間生活しても、土地に慣れるには時間がかかりますよね。ずっと東京のそばから離れたことがない自分でさえ、迷子になることがあり苦労しています。","10","1","9","好きなものについてはあまり興味ありません。自分の体のことに関心があります。","7","5","好きのことについての話題はあまり興味ありません。とりあえず今の外見について話したいです。","7","4","4","相手の考えに同意します。他の話題についても話したいです。","6","4","あなたの意見はもっともですね。他の話題も話しましょう。","6","3","4","51","それまでの会話の流れから、どんな気持ちかに注目しました。",""
"2023/12/25 7:47:03 AM GMT+9","hirowing","55","男","会話が飛んでいるので予想で答えます。
朝起きがにがてな人向けの対策本、コラムを
紹介した。","1","10","Aさんが好きな作家である宮沢賢治について
Bさんが持っているイメージに同意する。
Bさんにその作家の本をすすめる。","6","4","0","彼女がしている仕事、理想としていることにBさんが同意してくれたことに感謝。","8","1","Aさんが目標としているものをBさんに紹介てBさんが期待してることに感謝した。","6","6","7","同じ人を尊敬している同意。Aさんに自分のの実現しない希望を伝える。","6","7","坂本龍馬の行動力の凄さをAさんと同じく同意。そのあと不可能な夢を想像する。","8","4","8","新しい仕事にチャレンジしようとする気持ち。好きな食べ物を食べて元気をだす。","6","8","好物のうな丼で元気をだして、今まであまり変わりない生活を変えてみたいと思った。","6","3","8","少し嫌味を含めた感じです。相手の言葉に同意した感じです。","6","3","誕生日を今までおいめに感じていた。Aさんの考えに同意。","8","3","7","Bさんが方角音痴であることに同意。自分も方角音痴である事を伝える。","7","3","Bさんが土地に慣れるのに時間がかかっていますが、自分は長く住んでるけど今だに方角音痴だから気にすることはないと主張。","7","3","6","自分の身体的に嫌なところを伝える。身体的おいめを克服したいと思っている。","6","9","自分の好きな事が思い当たらない。自分の嫌な身体的な事を伝える。","5","8","9","寒い時期はインドアになりがちです。Aインドアでも好きな趣味だと楽しめることを教えてもらい同意す。","8","2","アウトドアが好きだが寒い時期はインドアになりがちでストレスがたまっている。家でできる趣味を探せばストレス発散になる事に同意。","7","3","9","80","会話の流れを重視しようとしたが唐突な会話もあり想像する所もありました。おおむね説明できたと思います。",""