"Timestamp","クラウドワークスのユーザー名を入力してください
承認作業に必要となります。ユーザー名が未入力もしくはクラウドワークス側での作業者情報と一致しない場合、恐れ入りますが報酬をお支払いできませんのでご注意ください。また、ユーザー名はヘッダーメニュー、またはプロフィールページからご確認いただけます。表示名とは異なりますのでご注意ください。","年齢(半角英数字)","性別","会話文1における「任せといて！」とはどういうことかを2文程度で説明してください．","会話文1における「任せといて！」という発言の意図がわかる．","会話文1における「任せといて！」という発言は唐突だ．","会話文2における「任せといて！」とはどういうことかを2文程度で説明してください．","会話文2における「任せといて！」という発言の意図がわかる．","会話文2における「任せといて！」という発言は唐突だ．","会話文1における「任せといて！」と会話文2における「任せといて！」の意味は同じですか，異なっていますか．あなたの考えに最も近いものを選んでください．","会話文3における「確かに、山梨の方言ってあまり聞かないわね。でもイメージ的にはホッコリしてそうね！」とはどういうことかを2文程度で説明してください．","会話文3における「確かに、山梨の方言ってあまり聞かないわね。でもイメージ的にはホッコリしてそうね！」という発言の意図がわかる．","会話文3における「確かに、山梨の方言ってあまり聞かないわね。でもイメージ的にはホッコリしてそうね！」という発言は唐突だ．","会話文4における「確かに、山梨の方言ってあまり聞かないわね。でもイメージ的にはホッコリしてそうね！」とはどういうことかを2文程度で説明してください．","会話文4における「確かに、山梨の方言ってあまり聞かないわね。でもイメージ的にはホッコリしてそうね！」という発言の意図がわかる．","会話文4における「確かに、山梨の方言ってあまり聞かないわね。でもイメージ的にはホッコリしてそうね！」という発言は唐突だ．","会話文3における「確かに、山梨の方言ってあまり聞かないわね。でもイメージ的にはホッコリしてそうね！」と会話文4における「確かに、山梨の方言ってあまり聞かないわね。でもイメージ的にはホッコリしてそうね！」の意味は同じですか，異なっていますか．あなたの考えに最も近いものを選んでください．","会話文5における「お互い、地道にがんばろ。」とはどういうことかを2文程度で説明してください．","会話文5における「お互い、地道にがんばろ。」という発言の意図がわかる．","会話文5における「お互い、地道にがんばろ。」という発言は唐突だ．","会話文6における「お互い、地道にがんばろ。」とはどういうことかを2文程度で説明してください．","会話文6における「お互い、地道にがんばろ。」という発言の意図がわかる．","会話文6における「お互い、地道にがんばろ。」という発言は唐突だ．","会話文5における「お互い、地道にがんばろ。」と会話文6における「お互い、地道にがんばろ。」の意味は同じですか，異なっていますか．あなたの考えに最も近いものを選んでください．","会話文7における「ですね、リフレッシュして明日からもお仕事頑張りましょう。」とはどういうことかを2文程度で説明してください．","会話文7における「ですね、リフレッシュして明日からもお仕事頑張りましょう。」という発言の意図がわかる．","会話文7における「ですね、リフレッシュして明日からもお仕事頑張りましょう。」という発言は唐突だ．","会話文8における「ですね、リフレッシュして明日からもお仕事頑張りましょう。」とはどういうことかを2文程度で説明してください．","会話文8における「ですね、リフレッシュして明日からもお仕事頑張りましょう。」という発言の意図がわかる．","会話文8における「ですね、リフレッシュして明日からもお仕事頑張りましょう。」という発言は唐突だ．","会話文7における「ですね、リフレッシュして明日からもお仕事頑張りましょう。」と会話文8における「ですね、リフレッシュして明日からもお仕事頑張りましょう。」の意味は同じですか，異なっていますか．あなたの考えに最も近いものを選んでください．","会話文9における「あ、でも、血液型占いってのは、あんまり当たらないから信じないほうがいいです！わたし、A型だけど全然几帳面じゃないですから。」とはどういうことかを2文程度で説明してください．","会話文9における「あ、でも、血液型占いってのは、あんまり当たらないから信じないほうがいいです！わたし、A型だけど全然几帳面じゃないですから。」という発言の意図がわかる．","会話文9における「あ、でも、血液型占いってのは、あんまり当たらないから信じないほうがいいです！わたし、A型だけど全然几帳面じゃないですから。」という発言は唐突だ．","会話文10における「あ、でも、血液型占いってのは、あんまり当たらないから信じないほうがいいです！わたし、A型だけど全然几帳面じゃないですから。」とはどういうことかを2文程度で説明してください．","会話文10における「あ、でも、血液型占いってのは、あんまり当たらないから信じないほうがいいです！わたし、A型だけど全然几帳面じゃないですから。」という発言の意図がわかる．","会話文10における「あ、でも、血液型占いってのは、あんまり当たらないから信じないほうがいいです！わたし、A型だけど全然几帳面じゃないですから。」という発言は唐突だ．","会話文9における「あ、でも、血液型占いってのは、あんまり当たらないから信じないほうがいいです！わたし、A型だけど全然几帳面じゃないですから。」と会話文10における「あ、でも、血液型占いってのは、あんまり当たらないから信じないほうがいいです！わたし、A型だけど全然几帳面じゃないですから。」の意味は同じですか，異なっていますか．あなたの考えに最も近いものを選んでください．","会話文11における「意外にお似合いなのかもね！」とはどういうことかを2文程度で説明してください．","会話文11における「意外にお似合いなのかもね！」という発言の意図がわかる．","会話文11における「意外にお似合いなのかもね！」という発言は唐突だ．","会話文12における「意外にお似合いなのかもね！」とはどういうことかを2文程度で説明してください．","会話文12における「意外にお似合いなのかもね！」という発言の意図がわかる．","会話文12における「意外にお似合いなのかもね！」という発言は唐突だ．","会話文11における「意外にお似合いなのかもね！」と会話文12における「意外にお似合いなのかもね！」の意味は同じですか，異なっていますか．あなたの考えに最も近いものを選んでください．","会話文13における「そうですね。都合よくね。」とはどういうことかを2文程度で説明してください．","会話文13における「そうですね。都合よくね。」という発言の意図がわかる．","会話文13における「そうですね。都合よくね。」という発言は唐突だ．","会話文14における「そうですね。都合よくね。」とはどういうことかを2文程度で説明してください．","会話文14における「そうですね。都合よくね。」という発言の意図がわかる．","会話文14における「そうですね。都合よくね。」という発言は唐突だ．","会話文13における「そうですね。都合よくね。」と会話文14における「そうですね。都合よくね。」の意味は同じですか，異なっていますか．あなたの考えに最も近いものを選んでください．","会話文15における「どっちも辛いねー。今いるところから引っ越したいとかは考えてないの？私は、いい加減、長崎が飽きちゃった。」とはどういうことかを2文程度で説明してください．","会話文15における「どっちも辛いねー。今いるところから引っ越したいとかは考えてないの？私は、いい加減、長崎が飽きちゃった。」という発言の意図がわかる．","会話文15における「どっちも辛いねー。今いるところから引っ越したいとかは考えてないの？私は、いい加減、長崎が飽きちゃった。」という発言は唐突だ．","会話文16における「どっちも辛いねー。今いるところから引っ越したいとかは考えてないの？私は、いい加減、長崎が飽きちゃった。」とはどういうことかを2文程度で説明してください．","会話文16における「どっちも辛いねー。今いるところから引っ越したいとかは考えてないの？私は、いい加減、長崎が飽きちゃった。」という発言の意図がわかる．","会話文16における「どっちも辛いねー。今いるところから引っ越したいとかは考えてないの？私は、いい加減、長崎が飽きちゃった。」という発言は唐突だ．","会話文15における「どっちも辛いねー。今いるところから引っ越したいとかは考えてないの？私は、いい加減、長崎が飽きちゃった。」と会話文16における「どっちも辛いねー。今いるところから引っ越したいとかは考えてないの？私は、いい加減、長崎が飽きちゃった。」の意味は同じですか，異なっていますか．あなたの考えに最も近いものを選んでください．","今回の調査でかかった時間(分)を教えてください．(半角英数字)","よろしければ今回2文程度で説明をする際，どこに注目をして説明したかを教えてください．",""
"2023/12/25 7:05:56 AM GMT+9","kouhei2014024","31","男","キャリアコンサルタントとして私に任せて下さい。キャリアコンサルタントとして頑張ります。","8","2","キャリアコンサルタントとして任せて下さい。あなたの相談にのります。","10","7","3","確かに山梨の方言はあまり聞いたことないです。でもイメージとしてはホッコリしている感じがします。","9","1","山梨の方言は好きで聞いてみたいけどあまり聞いたことがありません。でもイメージとしてはホッコリしている感じがします。","9","3","5","お互いに真面目に働きましょう。貯金や節約も頑張ろう。","5","1","お互いに真面目に働きましょう。部屋にクーラー付けることが出来るようにお互いに頑張ろう。","9","6","1","外に出てリフレッシュするのはいいですね。リフレッシュして明日からもお仕事頑張りましょう。","6","2","サイクリングや運動をするとリフレッシュできそうですね。リフレッシュして明日からもお仕事頑張りましょう。","8","4","9","でも、血液占いってあまり当たらないから信じない方が良いです。私A型だけど全然几帳面じゃないですから。","10","0","でも占いの中でも血液型占いってあまり当たらないので信じない方が良いです。私A型だけど、全然几帳面じゃないですから。","7","3","3","茶色の髪の毛にヒョウ柄のタンクトップですか。女豹っていう言葉、あなたにお似合いかもしれませんね。","1","9","女豹っていうツッコミ出来るくらいなんだから、きっとうまくやっていけますよ。2人はお似合いのカップルですよ。","10","3","0","占い師さんに言われたことなんて忘れます。都合よく良いことだけは覚えておきます。","7","2","占い師さんに言われたことは忘れるようにします。都合よく良いことだけ覚えておけばいいんですね。","6","3","10","どっちの仕事も辛いですね。今いるところから引っ越したいとかは考えてないんですか？私は、そろそろ長崎が飽きてしまいました。","10","1","タバコを吸う人にとっても吸わない人にとってもどちらも辛いですね。今いるところから引っ越したいとかは考えてないんですか？私は、そろそろ長崎が飽きてしまいました。","8","2","3","30","直前の文に注目して、何を言いたいかを判断し、説明しました。",""
"2023/12/25 7:45:35 AM GMT+9","みかん大好きっ子","50","女","徳島に来た時には私が案内するよ。すごく楽しい旅行にしてあげるよ
","9","2","仕事の相談だったらいつでも乗るよ。徳島に来た時にゆっくり話そう","8","8","1","ネイティブってほっこりという意味にとれるよね。何だか優しい感じ。","5","10","山梨の方言ってどんな感じ化良くわからない。でも聞いてみたいな。","9","9","9","お互い大変だけど頑張ろう。愚痴があったら又言い合おうね","10","0","夢の為には貯金が必要だね。大変だけど節約も仕事も頑張ろうね。","9","0","7","外に出て気晴らししましょう。屋内だけだとストレスたまりますからね。","7","0","気分転換にサイクリングはいいですよ。外の空気は最高です。","10","0","10","色々な占いがあるけど血液型占いは辞めた方がいいですよ。私失敗しましたから。","0","10","血液型占いよりも生年月日占いの方がいいですよ。私自身があるんです。","8","2","5","貴女の彼氏は面白いね。本当に素敵なカップルですよ。","10","0","なんだかんだ言って結局のろけてるだけじゃない。もう焼きもちを焼いてしまいそう。","5","5","4","いや解ってるんですけどね。それが難しいんですよ","2","2","そう考えるしかないんですよね。仕方ないですよね。","10","0","8","新しい所に引っ越したいけどお金もないし勇気が出ない。私って駄目だな。","10","0","絵を描くのが趣味ならばいっそのこと長崎を出ればいいのに。あなたなら大丈夫。","2","1","0","20","最後の文章","難しいです。読解力がないのでうまく答えられませんでした"
"2023/12/25 7:51:08 AM GMT+9","Madrededoro","46","女","次の旅行で徳島に来たときには車で観光案内をするから、何の心配も要らないよ。","9","2","自営としての通訳業がうまくいかずにスキルアップを考えているのであれば、キャリアコンサルタントの自分へ遠慮なく相談してほしい。","10","0","0","山梨県の訛りに惹かれるという相手に、具体的には特長が思いつかないものの素朴なイメージがあると言っている。","4","7","「山梨の方言」と言われてもピンと来ないが、心温まるような素朴なイメージを持っている。","10","0","9","コンビニのバイトとスーパーのパートタイマーという2人して決して高収入とは言えない労働だが、お互いにコツコツと仕事に励もうという意味。","9","0","資産管理を深く考えることはないが、貯金箱に小銭を入れる昔ながらの貯金方法でお互いの目標を叶えようという意味。","10","0","10","筋トレが得意な相手とアウトドアに出てリフレッシュすることができれば、仕事のストレスから解放され頑張れそうだという意味。","8","2","ホームヘルパーにソーシャルワーカーという奇しくも似た労働環境から解放されるべく、アウトドアで身体を動かしリフレッシュしようという提案。","10","0","8","占い的に運気が良さそうだと感じるけれど、血液型による占いは几帳面でないA型の自分がいるようにあてにならないと考えている。","9","1","占いに興味があり生年月日で詳しく占えるけれど、几帳面でないA型の自分がいるように血液型占いはあてにはならないとアドバイスしている。","10","0","9","関西弁が苦手という彼の割には、豹柄ファッションに女豹というツッコミを入れる夫婦漫才のようなやりとりを聞いて、お似合いのカップルだと感じる。","1","8","関西弁が嫌いという割に、夫婦漫才なやりとりを行う2人の様子を聞いて、思いの外お似合いの2人じゃないのか？と感じている。","9","0","7","占いを馬鹿正直に受け止めず、悪いことは忘れいいことだけ覚えておいて自分の都合に合わせればOKだということ。","6","5","人生における占いの存在など自分の都合に合わせて、いいことだけ記憶して悪いことは忘れてしまっていいんだという意味。","10","1","10","お互い辛い状況が続くが私が長崎から出たいように、あなたも移転を考えているか？と聞いている。","1","10","好きなことと無関係な仕事をすることも職場がタバコ臭いこと両方辛い。私は長崎から出たいがあなたは今いる場所に留まるつもりなのか？と聞いている。","5","7","0","50","AとBの性格や置かれた環境を把握した上で直前の会話に注目した。",""