Timestamp,年齢,性別,会話文1における「ひどーい！だから社交的なんだねーとか言ってくれてもいいじゃない！」とはどういうことかを2文程度で説明してください．,会話文1における「ひどーい！だから社交的なんだねーとか言ってくれてもいいじゃない！」という発言の意図がわかりますか．あなたの考えに最も近いものを選んでください．,会話文1における「ひどーい！だから社交的なんだねーとか言ってくれてもいいじゃない！」という発言は唐突ですか．あなたの考えに最も近いものを選んでください．,会話文2における「ひどーい！だから社交的なんだねーとか言ってくれてもいいじゃない！」とはどういうことかを2文程度で説明してください．,会話文2における「ひどーい！だから社交的なんだねーとか言ってくれてもいいじゃない！」という発言の意図がわかりますか．あなたの考えに最も近いものを選んでください．,会話文2における「ひどーい！だから社交的なんだねーとか言ってくれてもいいじゃない！」という発言は唐突ですか．あなたの考えに最も近いものを選んでください．,会話文1における「ひどーい！だから社交的なんだねーとか言ってくれてもいいじゃない！」と会話文2における「ひどーい！だから社交的なんだねーとか言ってくれてもいいじゃない！」の意味は同じですか，異なっていますか．あなたの考えに最も近いものを選んでください．,会話文1における「わたしの故郷は静岡なんですが、だからというわけなのか、よく好きで飲むのは緑茶なんです。あなたは三重県に住んでいらっしゃいますが、やはり伊勢エビとかをよく食べるとか？」とはどういうことかを2文程度で説明してください．,会話文1における「わたしの故郷は静岡なんですが、だからというわけなのか、よく好きで飲むのは緑茶なんです。あなたは三重県に住んでいらっしゃいますが、やはり伊勢エビとかをよく食べるとか？」という発言の意図がわかりますか．あなたの考えに最も近いものを選んでください．,会話文1における「わたしの故郷は静岡なんですが、だからというわけなのか、よく好きで飲むのは緑茶なんです。あなたは三重県に住んでいらっしゃいますが、やはり伊勢エビとかをよく食べるとか？」という発言は唐突ですか．あなたの考えに最も近いものを選んでください．,会話文2における「わたしの故郷は静岡なんですが、だからというわけなのか、よく好きで飲むのは緑茶なんです。あなたは三重県に住んでいらっしゃいますが、やはり伊勢エビとかをよく食べるとか？」とはどういうことかを2文程度で説明してください．,会話文2における「わたしの故郷は静岡なんですが、だからというわけなのか、よく好きで飲むのは緑茶なんです。あなたは三重県に住んでいらっしゃいますが、やはり伊勢エビとかをよく食べるとか？」という発言の意図がわかりますか．あなたの考えに最も近いものを選んでください．,会話文2における「わたしの故郷は静岡なんですが、だからというわけなのか、よく好きで飲むのは緑茶なんです。あなたは三重県に住んでいらっしゃいますが、やはり伊勢エビとかをよく食べるとか？」という発言は唐突ですか．あなたの考えに最も近いものを選んでください．,会話文1における「わたしの故郷は静岡なんですが、だからというわけなのか、よく好きで飲むのは緑茶なんです。あなたは三重県に住んでいらっしゃいますが、やはり伊勢エビとかをよく食べるとか？」と会話文2における「わたしの故郷は静岡なんですが、だからというわけなのか、よく好きで飲むのは緑茶なんです。あなたは三重県に住んでいらっしゃいますが、やはり伊勢エビとかをよく食べるとか？」の意味は同じですか，異なっていますか．あなたの考えに最も近いものを選んでください．,会話文1における「ちょっとなら、きっと大丈夫だと思うよ。」とはどういうことかを2文程度で説明してください．,会話文1における「ちょっとなら、きっと大丈夫だと思うよ。」という発言の意図がわかりますか．あなたの考えに最も近いものを選んでください．,会話文1における「ちょっとなら、きっと大丈夫だと思うよ。」という発言は唐突ですか．あなたの考えに最も近いものを選んでください．,会話文2における「ちょっとなら、きっと大丈夫だと思うよ。」とはどういうことかを2文程度で説明してください．,会話文2における「ちょっとなら、きっと大丈夫だと思うよ。」という発言の意図がわかりますか．あなたの考えに最も近いものを選んでください．,会話文2における「ちょっとなら、きっと大丈夫だと思うよ。」という発言は唐突ですか．あなたの考えに最も近いものを選んでください．,会話文1における「ちょっとなら、きっと大丈夫だと思うよ。」と会話文2における「ちょっとなら、きっと大丈夫だと思うよ。」の意味は同じですか，異なっていますか．あなたの考えに最も近いものを選んでください．,会話文1における「あ！それ名案です。一緒に暮らしている弟に合コンを主催してもらいますので、是非、一緒に参加してください！」とはどういうことかを2文程度で説明してください．,会話文1における「あ！それ名案です。一緒に暮らしている弟に合コンを主催してもらいますので、是非、一緒に参加してください！」という発言の意図がわかりますか．あなたの考えに最も近いものを選んでください．,会話文1における「あ！それ名案です。一緒に暮らしている弟に合コンを主催してもらいますので、是非、一緒に参加してください！」という発言は唐突ですか．あなたの考えに最も近いものを選んでください．,会話文2における「あ！それ名案です。一緒に暮らしている弟に合コンを主催してもらいますので、是非、一緒に参加してください！」とはどういうことかを2文程度で説明してください．,会話文2における「あ！それ名案です。一緒に暮らしている弟に合コンを主催してもらいますので、是非、一緒に参加してください！」という発言の意図がわかりますか．あなたの考えに最も近いものを選んでください．,会話文2における「あ！それ名案です。一緒に暮らしている弟に合コンを主催してもらいますので、是非、一緒に参加してください！」という発言は唐突ですか．あなたの考えに最も近いものを選んでください．,会話文1における「あ！それ名案です。一緒に暮らしている弟に合コンを主催してもらいますので、是非、一緒に参加してください！」と会話文2における「あ！それ名案です。一緒に暮らしている弟に合コンを主催してもらいますので、是非、一緒に参加してください！」の意味は同じですか，異なっていますか．あなたの考えに最も近いものを選んでください．,会話文1における「ああ、あれですよね、子どもを持たない主義の夫婦！」とはどういうことかを2文程度で説明してください．,会話文1における「ああ、あれですよね、子どもを持たない主義の夫婦！」という発言の意図がわかりますか．あなたの考えに最も近いものを選んでください．,会話文1における「ああ、あれですよね、子どもを持たない主義の夫婦！」という発言は唐突ですか．あなたの考えに最も近いものを選んでください．,会話文2における「ああ、あれですよね、子どもを持たない主義の夫婦！」とはどういうことかを2文程度で説明してください．,会話文2における「ああ、あれですよね、子どもを持たない主義の夫婦！」という発言の意図がわかりますか．あなたの考えに最も近いものを選んでください．,会話文2における「ああ、あれですよね、子どもを持たない主義の夫婦！」という発言は唐突ですか．あなたの考えに最も近いものを選んでください．,会話文1における「ああ、あれですよね、子どもを持たない主義の夫婦！」と会話文2における「ああ、あれですよね、子どもを持たない主義の夫婦！」の意味は同じですか，異なっていますか．あなたの考えに最も近いものを選んでください．,会話文1における「本当ね！わたしも人を喜ばせるのが好きだしね！」とはどういうことかを2文程度で説明してください．,会話文1における「本当ね！わたしも人を喜ばせるのが好きだしね！」という発言の意図がわかりますか．あなたの考えに最も近いものを選んでください．,会話文1における「本当ね！わたしも人を喜ばせるのが好きだしね！」という発言は唐突ですか．あなたの考えに最も近いものを選んでください．,会話文2における「本当ね！わたしも人を喜ばせるのが好きだしね！」とはどういうことかを2文程度で説明してください．,会話文2における「本当ね！わたしも人を喜ばせるのが好きだしね！」という発言の意図がわかりますか．あなたの考えに最も近いものを選んでください．,会話文2における「本当ね！わたしも人を喜ばせるのが好きだしね！」という発言は唐突ですか．あなたの考えに最も近いものを選んでください．,会話文1における「本当ね！わたしも人を喜ばせるのが好きだしね！」と会話文2における「本当ね！わたしも人を喜ばせるのが好きだしね！」の意味は同じですか，異なっていますか．あなたの考えに最も近いものを選んでください．,会話文1における「ああ、そういうことかあ。豚骨ラーメンって、髪の毛にも良さそうだよね。ツヤツヤになりそうだと思わない？」とはどういうことかを2文程度で説明してください．,会話文1における「ああ、そういうことかあ。豚骨ラーメンって、髪の毛にも良さそうだよね。ツヤツヤになりそうだと思わない？」という発言の意図がわかりますか．あなたの考えに最も近いものを選んでください．,会話文1における「ああ、そういうことかあ。豚骨ラーメンって、髪の毛にも良さそうだよね。ツヤツヤになりそうだと思わない？」という発言は唐突ですか．あなたの考えに最も近いものを選んでください．,会話文2における「ああ、そういうことかあ。豚骨ラーメンって、髪の毛にも良さそうだよね。ツヤツヤになりそうだと思わない？」とはどういうことかを2文程度で説明してください．,会話文2における「ああ、そういうことかあ。豚骨ラーメンって、髪の毛にも良さそうだよね。ツヤツヤになりそうだと思わない？」という発言の意図がわかりますか．あなたの考えに最も近いものを選んでください．,会話文2における「ああ、そういうことかあ。豚骨ラーメンって、髪の毛にも良さそうだよね。ツヤツヤになりそうだと思わない？」という発言は唐突ですか．あなたの考えに最も近いものを選んでください．,会話文1における「ああ、そういうことかあ。豚骨ラーメンって、髪の毛にも良さそうだよね。ツヤツヤになりそうだと思わない？」と会話文2における「ああ、そういうことかあ。豚骨ラーメンって、髪の毛にも良さそうだよね。ツヤツヤになりそうだと思わない？」の意味は同じですか，異なっていますか．あなたの考えに最も近いものを選んでください．,会話文1における「なるほど、お医者様なら忙しいですよね。わたしはマッサージ師をしているので、まだお医者さまよりは時間があるほうなのかも。」とはどういうことかを2文程度で説明してください．,会話文1における「なるほど、お医者様なら忙しいですよね。わたしはマッサージ師をしているので、まだお医者さまよりは時間があるほうなのかも。」という発言の意図がわかりますか．あなたの考えに最も近いものを選んでください．,会話文1における「なるほど、お医者様なら忙しいですよね。わたしはマッサージ師をしているので、まだお医者さまよりは時間があるほうなのかも。」という発言は唐突ですか．あなたの考えに最も近いものを選んでください．,会話文2における「なるほど、お医者様なら忙しいですよね。わたしはマッサージ師をしているので、まだお医者さまよりは時間があるほうなのかも。」とはどういうことかを2文程度で説明してください．,会話文2における「なるほど、お医者様なら忙しいですよね。わたしはマッサージ師をしているので、まだお医者さまよりは時間があるほうなのかも。」という発言の意図がわかりますか．あなたの考えに最も近いものを選んでください．,会話文2における「なるほど、お医者様なら忙しいですよね。わたしはマッサージ師をしているので、まだお医者さまよりは時間があるほうなのかも。」という発言は唐突ですか．あなたの考えに最も近いものを選んでください．,会話文1における「なるほど、お医者様なら忙しいですよね。わたしはマッサージ師をしているので、まだお医者さまよりは時間があるほうなのかも。」と会話文2における「なるほど、お医者様なら忙しいですよね。わたしはマッサージ師をしているので、まだお医者さまよりは時間があるほうなのかも。」の意味は同じですか，異なっていますか．あなたの考えに最も近いものを選んでください．,会話文1における「わたしの尊敬する人が坂本龍馬なもんでよく四国のあたりを旅行するんですが、お好み焼きもそうで寿司本当に美味しいものが多いですよね。」とはどういうことかを2文程度で説明してください．,会話文1における「わたしの尊敬する人が坂本龍馬なもんでよく四国のあたりを旅行するんですが、お好み焼きもそうで寿司本当に美味しいものが多いですよね。」という発言の意図がわかりますか．あなたの考えに最も近いものを選んでください．,会話文1における「わたしの尊敬する人が坂本龍馬なもんでよく四国のあたりを旅行するんですが、お好み焼きもそうで寿司本当に美味しいものが多いですよね。」という発言は唐突ですか．あなたの考えに最も近いものを選んでください．,会話文2における「わたしの尊敬する人が坂本龍馬なもんでよく四国のあたりを旅行するんですが、お好み焼きもそうで寿司本当に美味しいものが多いですよね。」とはどういうことかを2文程度で説明してください．,会話文2における「わたしの尊敬する人が坂本龍馬なもんでよく四国のあたりを旅行するんですが、お好み焼きもそうで寿司本当に美味しいものが多いですよね。」という発言の意図がわかりますか．あなたの考えに最も近いものを選んでください．,会話文2における「わたしの尊敬する人が坂本龍馬なもんでよく四国のあたりを旅行するんですが、お好み焼きもそうで寿司本当に美味しいものが多いですよね。」という発言は唐突ですか．あなたの考えに最も近いものを選んでください．,会話文1における「わたしの尊敬する人が坂本龍馬なもんでよく四国のあたりを旅行するんですが、お好み焼きもそうで寿司本当に美味しいものが多いですよね。」と会話文2における「わたしの尊敬する人が坂本龍馬なもんでよく四国のあたりを旅行するんですが、お好み焼きもそうで寿司本当に美味しいものが多いですよね。」の意味は同じですか，異なっていますか．あなたの考えに最も近いものを選んでください．,会話文1における「こう見えてわたしもバイクに乗るのよ！あなたは鳥取砂丘に行ったことある？」とはどういうことかを2文程度で説明してください．,会話文1における「こう見えてわたしもバイクに乗るのよ！あなたは鳥取砂丘に行ったことある？」という発言の意図がわかりますか．あなたの考えに最も近いものを選んでください．,会話文1における「こう見えてわたしもバイクに乗るのよ！あなたは鳥取砂丘に行ったことある？」という発言は唐突ですか．あなたの考えに最も近いものを選んでください．,会話文2における「こう見えてわたしもバイクに乗るのよ！あなたは鳥取砂丘に行ったことある？」とはどういうことかを2文程度で説明してください．,会話文2における「こう見えてわたしもバイクに乗るのよ！あなたは鳥取砂丘に行ったことある？」という発言の意図がわかりますか．あなたの考えに最も近いものを選んでください．,会話文2における「こう見えてわたしもバイクに乗るのよ！あなたは鳥取砂丘に行ったことある？」という発言は唐突ですか．あなたの考えに最も近いものを選んでください．,会話文1における「こう見えてわたしもバイクに乗るのよ！あなたは鳥取砂丘に行ったことある？」と会話文2における「こう見えてわたしもバイクに乗るのよ！あなたは鳥取砂丘に行ったことある？」の意味は同じですか，異なっていますか．あなたの考えに最も近いものを選んでください．
5/20/2023 1:57:38,39,女,"大らかっていうぐらいだから、オオ型なんだろうね？
変なことを言っちゃうんだ",あまりわからない,やや唐突である,"ふーん。そうかい。
それで？",ある程度わかる,やや唐突である,少し異なっている,"静岡はお茶が有名だから、よく好きで飲むのは緑茶なんです。
あなたは、三重県に住んでいるから、有名な伊勢エビはよく食べますか？",あまりわからない,非常に唐突である,"静岡はお茶が有名だから、よく好きで飲むのは緑茶なんです。
あなたは、三重県に住んでいるから、有名な伊勢エビはよく食べますか？",ある程度わかる,やや唐突である,少し異なっている,"好き嫌いは、段々なくなるから大丈夫
人参が嫌いだけど、ちょっとなら食べれる。",全くわからない,非常に唐突である,"猫アレルギーだから、飼う事ができない。
けど、触ってみたい。",あまりわからない,非常に唐突である,完全に異なっている,"悲観的に物を考えるので、占いで一歩背中を押す癖がついてしまった。
失敗しても占いのせいにできる。",ある程度わかる,やや唐突である,"女性と話すのが下手なので、占いをネタにして、盛り上がれるか占って
みましょう。",あまりわからない,やや唐突である,少し異なっている,"新聞社に勤めている、子どもを持たない主義の夫婦
の方ですよね。",ある程度わかる,やや唐突である,"DINKs＝子どもを持たない主義の夫婦
という説明",おおよそわかる,やや唐突である,大いに異なっている,"ブライダル関係はお祝い事なので、喜ばしい仕事
だということ。",おおよそわかる,あまり唐突ではない,"わたしたちが組んだら、人を喜ばせることが
できるよね。",おおよそわかる,やや唐突である,少し異なっている,"三食ラーメンでもいいくらいラーメンが好きだから気持ちが
わからないわけではない。",あまりわからない,やや唐突である,"生まれたところと好物って関連するよね。
わたしも生まれも今住んでいるところも九州だから、ラーメンは豚骨にかぎる。",ある程度わかる,やや唐突である,大いに異なっている,"元々運動は好きな方なので、大体のスポーツはいけます。
",あまりわからない,やや唐突である,"元々運動は好きな方なので、大体のスポーツはいけますが
今は忙しいので趣味はゴルフくらいになっている。",ある程度わかる,あまり唐突ではない,少し異なっている,広島県内に住んでいる。,あまりわからない,やや唐突である,"広島県内に住んでいる
お好み焼きが美味しい",おおよそわかる,やや唐突である,少し異なっている,"周りの人から夢見がちだって言われて
いるけど。",おおよそわかる,やや唐突である,"周りの人から夢見がちだって言われて
いるけど、車じゃなくてバイクに乗るの。",おおよそわかる,やや唐突である,少し異なっている
